{
  "$schema": "https://json-schema.org/draft/2020-12/schema",
  "$id": "https://github.com/baristaze/swe_guidelines/benchmark/schema/result.schema.json",
  "title": "Benchmark run result",
  "description": "What one benchmark run produced: the subject, every repeat, every judgement, and the summary.",
  "type": "object",
  "required": [
    "schema_version",
    "run_id",
    "scenario",
    "runtime",
    "started_at",
    "finished_at",
    "guideline_sha",
    "target_sha",
    "subject",
    "repeats",
    "summary"
  ],
  "additionalProperties": false,
  "properties": {
    "schema_version": { "type": "integer", "minimum": 1 },
    "run_id": { "type": "string", "minLength": 1 },
    "scenario": { "type": "string", "minLength": 1 },
    "runtime": { "type": "string", "enum": ["host", "container", "vm"] },
    "started_at": { "type": "string" },
    "finished_at": { "type": "string" },
    "guideline_sha": { "type": "string" },
    "target_sha": { "type": ["string", "null"] },
    "versions": {
      "description": "Every version that decides a score, each as a reference that resolves off the machine that ran it: the checkout, Claude Code as the runtime answers it, the image, and the target and the expected findings by path and content hash.",
      "type": "object",
      "additionalProperties": false,
      "properties": {
        "checkout": {
          "type": "object",
          "required": ["commit", "plugin_version", "dirty", "dirty_paths", "dirty_sha256"],
          "additionalProperties": false,
          "properties": {
            "commit": { "type": "string" },
            "plugin_version": { "type": ["string", "null"] },
            "dirty": {
              "description": "Whether the checkout held changes no commit holds, in the paths that decide a score; null when it is not a git checkout.",
              "type": ["boolean", "null"]
            },
            "dirty_paths": { "type": "array", "items": { "type": "string" } },
            "dirty_sha256": { "type": ["string", "null"] }
          }
        },
        "claude_code": {
          "description": "What `claude --version` answered inside the runtime; null when the subject runs no Claude Code or the runtime did not answer.",
          "type": ["string", "null"]
        },
        "image": {
          "description": "The container image by name and by the id the engine gives it; null outside the container runtime.",
          "type": ["object", "null"],
          "required": ["name", "id"],
          "additionalProperties": false,
          "properties": {
            "name": { "type": "string" },
            "id": { "type": ["string", "null"] }
          }
        },
        "target": { "$ref": "#/$defs/content" },
        "expected": { "$ref": "#/$defs/content" }
      }
    },
    "notes": { "type": "array", "items": { "type": "string" } },
    "spend": {
      "description": "What the run spent: tokens and US dollars per judge, for the subject, and in all. A model with no price is named under unpriced, and its cost is not in any figure.",
      "type": "object",
      "required": ["judges", "subject", "total_usd", "unpriced"],
      "additionalProperties": false,
      "properties": {
        "judges": { "type": "object", "additionalProperties": { "$ref": "#/$defs/spent" } },
        "subject": { "$ref": "#/$defs/spent" },
        "total_usd": { "type": "number", "minimum": 0 },
        "unpriced": { "type": "array", "items": { "type": "string" } }
      }
    },
    "subject": {
      "type": "object",
      "required": ["kind"],
      "properties": {
        "kind": { "type": "string", "enum": ["skill", "command", "qa"] },
        "skill": { "type": ["string", "null"] },
        "prompt": { "type": "string" },
        "argv": { "type": "array", "items": { "type": "string" } },
        "model": { "type": ["string", "null"] },
        "provider": { "type": ["string", "null"] },
        "target": { "type": ["string", "null"] },
        "plugin": { "type": ["string", "null"] },
        "max_turns": { "type": "integer" },
        "allowed_tools": { "type": "array", "items": { "type": "string" } }
      }
    },
    "repeats": {
      "type": "array",
      "items": {
        "type": "object",
        "required": ["index", "exit_status", "artifact_paths", "judgements"],
        "additionalProperties": false,
        "properties": {
          "index": { "type": "integer", "minimum": 0 },
          "exit_status": {
            "type": "object",
            "required": ["code"],
            "properties": {
              "code": { "type": "integer" },
              "signal": { "type": ["integer", "null"] },
              "duration_s": { "type": "number" },
              "timed_out": { "type": "boolean" },
              "is_error": { "type": "boolean" },
              "stopped": { "description": "The harness stopped the subject at a bound before it ended.", "type": "boolean" }
            }
          },
          "artifact_paths": { "type": "array", "items": { "type": "string" } },
          "phases": {
            "description": "A skill subject's sessions, in order: how each ended, the bound that ended it, its turns, and what it spent. Only the phases that ran.",
            "type": "array",
            "items": { "$ref": "#/$defs/phase" }
          },
          "archive": {
            "description": "The output's last commit as a zip: its path and its manifest's in the run folder, its SHA-256, its size, how many files it holds, and the commit.",
            "type": "object",
            "required": ["path", "manifest", "sha256", "bytes", "files"],
            "additionalProperties": false,
            "properties": {
              "path": { "type": "string" },
              "manifest": { "type": "string" },
              "sha256": { "type": "string", "pattern": "^[0-9a-f]{64}$" },
              "bytes": { "type": "integer", "minimum": 0 },
              "files": { "type": "integer", "minimum": 0 },
              "commit": { "type": ["string", "null"] }
            }
          },
          "gates": {
            "description": "The scenario's gates, run on the final tree after the last phase; recorded beside the scores, never a cap on them.",
            "type": "array",
            "items": {
              "type": "object",
              "required": ["command", "passed", "exit_code"],
              "additionalProperties": false,
              "properties": {
                "command": { "type": "string" },
                "passed": { "type": "boolean" },
                "exit_code": { "type": "integer" },
                "timed_out": { "type": "boolean" },
                "duration_s": { "type": "number", "minimum": 0 }
              }
            }
          },
          "subject_models": {
            "description": "The models the subject's envelope reports it ran on.",
            "type": "array",
            "items": { "type": "string" }
          },
          "subject_usage": {
            "description": "The subject's tokens: input_tokens counts every input token, cached or not; output_tokens includes the reasoning.",
            "type": "object",
            "additionalProperties": { "type": "integer", "minimum": 0 }
          },
          "subject_cost_usd": {
            "description": "The subject's cost in US dollars: Claude Code's own figure for a skill, the list price for a qa answer; null when unknown.",
            "type": ["number", "null"],
            "minimum": 0
          },
          "expected": {
            "description": "Which planted findings the artifact names by lens id and file; present only when the scenario plants some.",
            "type": "object",
            "required": ["expected", "named", "missed"],
            "additionalProperties": false,
            "properties": {
              "expected": { "type": "integer", "minimum": 0 },
              "named": { "type": "array", "items": { "type": "string" } },
              "missed": { "type": "array", "items": { "type": "string" } }
            }
          },
          "judgements": {
            "type": "array",
            "items": {
              "type": "object",
              "required": ["provider", "model", "effort", "status", "latency_s", "verdict"],
              "additionalProperties": false,
              "properties": {
                "provider": { "type": "string", "enum": ["anthropic", "openai", "gemini", "xai"] },
                "model": { "type": "string" },
                "effort": { "type": "string" },
                "status": { "type": "string", "enum": ["ok", "skipped", "error"] },
                "latency_s": { "type": "number", "minimum": 0 },
                "usage": {
                  "description": "input_tokens, output_tokens with the reasoning included, and reasoning_tokens when the provider reports it.",
                  "type": "object",
                  "additionalProperties": { "type": "integer" }
                },
                "cost_usd": {
                  "description": "The usage at the matrix's list price; null when the model has no price.",
                  "type": ["number", "null"],
                  "minimum": 0
                },
                "error": { "type": ["string", "null"] },
                "fallback": {
                  "description": "The model the matrix put first and why it did not answer, when a later model answered in its place.",
                  "oneOf": [
                    { "type": "null" },
                    {
                      "type": "object",
                      "required": ["from", "reason"],
                      "additionalProperties": false,
                      "properties": {
                        "from": { "type": "string" },
                        "reason": { "type": "string" }
                      }
                    }
                  ]
                },
                "verdict": {
                  "oneOf": [
                    { "type": "null" },
                    {
                      "type": "object",
                      "required": ["score", "verdict", "findings", "strengths", "rationale"],
                      "additionalProperties": false,
                      "properties": {
                        "score": { "type": "integer", "minimum": 0, "maximum": 100 },
                        "verdict": { "type": "string", "enum": ["pass", "weak", "fail"] },
                        "findings": {
                          "type": "array",
                          "items": {
                            "type": "object",
                            "required": ["severity", "note"],
                            "additionalProperties": false,
                            "properties": {
                              "severity": { "type": "string" },
                              "note": { "type": "string" }
                            }
                          }
                        },
                        "strengths": { "type": "array", "items": { "type": "string" } },
                        "rationale": { "type": "string" }
                      }
                    }
                  ]
                }
              }
            }
          }
        }
      }
    },
    "summary": {
      "type": "object",
      "required": ["per_provider", "overall_mean", "skipped"],
      "additionalProperties": false,
      "properties": {
        "per_provider": {
          "type": "object",
          "additionalProperties": {
            "type": "object",
            "required": ["mean", "min", "max", "n", "stdev"],
            "additionalProperties": false,
            "properties": {
              "mean": { "type": "number" },
              "min": { "type": "integer" },
              "max": { "type": "integer" },
              "n": { "type": "integer", "minimum": 0 },
              "stdev": { "type": ["number", "null"] }
            }
          }
        },
        "overall_mean": { "type": ["number", "null"] },
        "failed_repeats": {
          "description": "The repeats whose subject failed; each scores 0 in every provider's mean.",
          "type": "array",
          "items": { "type": "integer", "minimum": 0 }
        },
        "spread": {
          "description": "Each scored repeat's mean over its providers, a failed repeat as 0, and their range and standard deviation.",
          "oneOf": [
            { "type": "null" },
            {
              "type": "object",
              "required": ["repeat_means", "min", "max", "stdev"],
              "additionalProperties": false,
              "properties": {
                "repeat_means": { "type": "array", "items": { "type": "number" } },
                "min": { "type": "number" },
                "max": { "type": "number" },
                "stdev": { "type": ["number", "null"] }
              }
            }
          ]
        },
        "self_judged": {
          "description": "Set when a Claude subject is judged by a panel that scores with Claude.",
          "type": ["string", "null"]
        },
        "skipped": {
          "type": "array",
          "items": {
            "type": "object",
            "required": ["provider", "reason"],
            "additionalProperties": false,
            "properties": {
              "provider": { "type": "string" },
              "reason": { "type": "string" }
            }
          }
        },
        "fallbacks": {
          "type": "array",
          "items": {
            "type": "object",
            "required": ["provider", "from", "to", "count", "reason"],
            "additionalProperties": false,
            "properties": {
              "provider": { "type": "string" },
              "from": { "type": "string" },
              "to": { "type": "string" },
              "count": { "type": "integer", "minimum": 1 },
              "reason": { "type": "string" }
            }
          }
        },
        "missed": {
          "type": "array",
          "items": {
            "type": "object",
            "required": ["provider", "count", "reason"],
            "additionalProperties": false,
            "properties": {
              "provider": { "type": "string" },
              "count": { "type": "integer", "minimum": 1 },
              "reason": { "type": "string" }
            }
          }
        }
      }
    }
  },
  "$defs": {
    "phase": {
      "type": "object",
      "required": ["name", "session", "status", "capped"],
      "additionalProperties": false,
      "properties": {
        "name": { "type": "string" },
        "session": { "type": "string", "enum": ["fresh", "resume"] },
        "status": { "type": "string", "enum": ["ok", "capped", "failed"] },
        "capped": { "type": ["string", "null"], "enum": ["turns", "spend", "gate_reruns", null] },
        "exit_status": { "type": "object" },
        "session_id": { "type": ["string", "null"] },
        "turns": { "type": ["integer", "null"], "minimum": 0 },
        "models": { "type": "array", "items": { "type": "string" } },
        "cost_usd": {
          "description": "What Claude Code says the session cost; for a resumed session, what it added to the session's running total; null when it wrote no result.",
          "type": ["number", "null"],
          "minimum": 0
        },
        "estimated_usd": {
          "description": "What the harness priced the session's stream at, the figure it holds the spend cap by.",
          "type": "number",
          "minimum": 0
        },
        "unpriced": { "type": "array", "items": { "type": "string" } },
        "gate_runs": {
          "description": "Each gate's runs in the session, its failures, the runs whose outcome was not read, and whether its last read run failed.",
          "type": "object",
          "additionalProperties": {
            "type": "object",
            "required": ["runs", "failed", "unread", "failing"],
            "additionalProperties": false,
            "properties": {
              "runs": { "type": "integer", "minimum": 0 },
              "failed": { "type": "integer", "minimum": 0 },
              "unread": { "description": "Runs whose outcome is not the call's: the gate piped, or followed by ;, ||, or &.", "type": "integer", "minimum": 0 },
              "failing": { "type": "boolean" }
            }
          }
        },
        "checkpoint": { "description": "The commit made in the output folder after the phase; null when none was.", "type": ["string", "null"] }
      }
    },
    "content": {
      "description": "A file or a folder by its path, relative to the repository when it is inside it, and the SHA-256 of its content.",
      "type": ["object", "null"],
      "required": ["path", "sha256"],
      "additionalProperties": false,
      "properties": {
        "path": { "type": "string" },
        "sha256": { "type": "string", "pattern": "^[0-9a-f]{64}$" }
      }
    },
    "spent": {
      "type": "object",
      "required": ["input_tokens", "output_tokens", "reasoning_tokens", "cost_usd", "unpriced"],
      "additionalProperties": false,
      "properties": {
        "input_tokens": { "type": "integer", "minimum": 0 },
        "output_tokens": { "type": "integer", "minimum": 0 },
        "reasoning_tokens": { "type": "integer", "minimum": 0 },
        "cost_usd": { "type": "number", "minimum": 0 },
        "unpriced": { "type": "array", "items": { "type": "string" } }
      }
    }
  }
}
