{
  "schema_version": 1,
  "run_id": "20260927-055257-review-om-ac618e8a",
  "scenario": "review-om",
  "runtime": "container",
  "started_at": "2026-09-27T12:52:57Z",
  "finished_at": "2026-09-27T13:11:53Z",
  "guideline_sha": "00e773dd5df1cf9f35cee70f209fc86bc842d2b6",
  "target_sha": "00e773dd5df1cf9f35cee70f209fc86bc842d2b6",
  "subject": {
    "kind": "skill",
    "skill": "arch-review-om",
    "prompt": "Review {target}/om against the object model lenses and report findings by lens id.",
    "argv": [
      "claude",
      "-p",
      "/swe-guidelines:arch-review-om Review /target/om against the object model lenses and report findings by lens id.",
      "--plugin-dir",
      "/plugin",
      "--output-format",
      "json",
      "--max-turns",
      "30",
      "--model",
      "claude-opus-5-5",
      "--add-dir",
      "/target",
      "--allowedTools",
      "Read,Grep,Glob"
    ],
    "model": "claude-opus-5-5",
    "provider": null,
    "target": "/Users/baris/code/swe-wt/benchmark-runs-checked-in/benchmark/fixtures/review-om",
    "plugin": "/plugin",
    "max_turns": 30,
    "allowed_tools": [
      "Read",
      "Grep",
      "Glob"
    ]
  },
  "repeats": [
    {
      "index": 0,
      "exit_status": {
        "code": 0,
        "signal": null,
        "duration_s": 65.31,
        "timed_out": false,
        "is_error": false
      },
      "artifact_paths": [
        "artifacts/0/answer.md"
      ],
      "subject_models": [
        "claude-opus-5-5"
      ],
      "judgements": [
        {
          "provider": "anthropic",
          "model": "claude-opus-5-5",
          "effort": "high",
          "status": "ok",
          "latency_s": 19.108,
          "usage": {
            "input_tokens": 8690,
            "output_tokens": 1807
          },
          "error": null,
          "fallback": null,
          "verdict": {
            "score": 78,
            "verdict": "pass",
            "findings": [
              {
                "severity": "medium",
                "note": "The OM-16 finding at base.py:1 asks for new tenancy and audit namespaces; nothing in the source bears it out, and the evidence counts passing tenancy to storage as correct (OM-02), so this reads as speculative advice."
              },
              {
                "severity": "medium",
                "note": "Three OM-03 findings (bin.py:9, stock_movement.py:6, warehouse.py:4) demand a MANAGER_OWNED_FIELDS tuple; the checkout never defines one, the planted list does not include it, and the review quotes no rule behind it, so the source does not support them."
              },
              {
                "severity": "low",
                "note": "The OM-14 finding at storage/__init__.py:23 on the name write_movement goes beyond the evidence, which lists the inventory namespace layout as correct under OM-14, and it cites no naming rule."
              },
              {
                "severity": "low",
                "note": "No finding quotes the guideline rule it rests on or separates what the guideline requires from what the reviewer prefers, and nearly every finding is uniformly 'medium' whatever its weight."
              },
              {
                "severity": "low",
                "note": "Two defects are split into several entries: OM-15 at rules.py:3 and :11, and F5 reported under both OM-05 and OM-06. The OM-05 duplicate proposes the same fix under a second lens, which inflates the finding count."
              }
            ],
            "strengths": [
              "All eight planted defects are reported under the correct lens, at the correct file and line: OM-04, OM-17, OM-03 created_at, OM-13 NO_BIN, OM-06, OM-12, OM-10 and OM-15.",
              "Each fix is concrete and matches the intended remedy, for example model_validate in update_warehouse, new_id() in create_bin, `now` as a parameter to is_stale, and `parent_bin_id: UUID | None = None`.",
              "No clean item is flagged, and the Passed list correctly credits base.py for OM-07 and OM-11.",
              "The scope section is honest about tool limits (not a git repo, arch-check exit 1, partial coverage), and the review only reports without editing anything."
            ],
            "rationale": "Recall is complete: all eight planted findings appear at the right lens, file and line. Precision is dented by about five findings the evidence does not bear out: the OM-16 tenancy/audit namespaces, three OM-03 MANAGER_OWNED_FIELDS demands, and the OM-14 renaming. Form is decent on lens id, location and fix, but no finding quotes a rule or separates requirement from preference. Together these put the review in the high 70s."
          }
        },
        {
          "provider": "openai",
          "model": "gpt-6-sol",
          "effort": "high",
          "status": "ok",
          "latency_s": 27.355,
          "usage": {
            "input_tokens": 5348,
            "output_tokens": 2046
          },
          "error": null,
          "fallback": null,
          "verdict": {
            "score": 76,
            "verdict": "weak",
            "findings": [
              {
                "severity": "medium",
                "note": "The OM-16 finding at `om/src/acme/om/base.py:1` does not establish why use of `ctx.org_id` and `ctx.user_id` requires separate tenancy and audit namespaces."
              },
              {
                "severity": "medium",
                "note": "The OM-14 finding at `om/src/acme/om/inventory/storage/__init__.py:23` does not substantiate a rule requiring `write_movement` to spell out the full entity name."
              },
              {
                "severity": "medium",
                "note": "The three OM-03 findings in `bin.py`, `stock_movement.py`, and `warehouse.py` assert a required `MANAGER_OWNED_FIELDS` tuple without support in the supplied evidence, and their advice to exclude provenance fields does not account for fields required to rebuild the models."
              },
              {
                "severity": "medium",
                "note": "The OM-05 finding at `om/src/acme/om/inventory/types/stock_movement.py:6` says no manager method sets `updated_at` or `updated_by`, but `record_movement` sets both at `impl/manager.py:63-65`."
              },
              {
                "severity": "low",
                "note": "The findings summary says 11 findings, while the artifact lists 16 bullets, and none of those bullets quotes the rule it relies on."
              }
            ],
            "strengths": [
              "The review reports all eight planted defects at the right files and near the right lines.",
              "The OM-10, OM-12, and OM-15 findings give concrete changes that address the defects shown in the source.",
              "It does not flag the listed correct behavior of warehouse deletion, bin movement, or movement ID generation."
            ],
            "rationale": "Complete recall earns substantial credit, including the correct OM-06 finding despite a contradictory OM-05 bullet about the same entity. Precision is weaker: several additional findings impose requirements the evidence does not support, and one makes a claim the manager implementation directly disproves. The inconsistent count and lack of rule quotations further reduce the score."
          }
        },
        {
          "provider": "gemini",
          "model": "gemini-3.1-pro-preview",
          "effort": "high",
          "status": "ok",
          "latency_s": 33.102,
          "usage": {
            "input_tokens": 6044,
            "output_tokens": 375
          },
          "error": null,
          "fallback": null,
          "verdict": {
            "score": 60,
            "verdict": "weak",
            "findings": [
              {
                "severity": "high",
                "note": "The artifact hallucinates a requirement for a `MANAGER_OWNED_FIELDS` tuple, fabricating three separate unsupported OM-03 findings."
              },
              {
                "severity": "high",
                "note": "The review invents a requirement for tenancy and audit namespaces, applying an unsupported OM-16 lens."
              },
              {
                "severity": "high",
                "note": "The artifact hallucinates a rule dictating method naming for `write_movement` versus the entity name under OM-14."
              },
              {
                "severity": "medium",
                "note": "None of the findings quote the guideline rule they rest on, violating the required form specified in the rubric."
              },
              {
                "severity": "low",
                "note": "The preamble claims there are 11 findings, but the list actually contains 16 bullet points."
              }
            ],
            "strengths": [
              "Achieves perfect recall by successfully identifying all eight planted defects.",
              "Points to accurate file paths and line numbers for the true findings.",
              "Provides clear and actionable 'Fix' instructions for the identified defects."
            ],
            "rationale": "The review secures a solid base score by successfully catching every planted defect in the source code. However, it is heavily penalized for poor precision because it invents five unsupported findings related to missing fields, namespaces, and naming conventions. Additionally, the reviewer failed to follow the required form by omitting quotes of the rules being applied."
          }
        },
        {
          "provider": "xai",
          "model": "grok-4.7",
          "effort": "high",
          "status": "ok",
          "latency_s": 214.659,
          "usage": {
            "input_tokens": 7079,
            "output_tokens": 467
          },
          "error": null,
          "fallback": null,
          "verdict": {
            "score": 64,
            "verdict": "weak",